author,contributions,rating,date_of_stay,trip_type,title,content,tip,response
,,5,February 2025,,Outstanding Service and Beautiful Property,"The service at this hotel is unmatched, and the owner and staff are extraordinary in their attention to detail and customer focus. The property is conveniently located, and the rooms are well appointed with every modern convenience. The food and spa are excellent too. I could not recommend this place highly enough.",,"Christian de Boer, Owner|Good afternoon and thank you for the effort made to write down your experience with us. ""beautiful property' - it’s making me rather happy to know that you have valued our location and grounds plus the efforts made by the team here in Siem Reap. On behalf of all of us I hope that we will be able to welcome you back at some point in the not too distant future. But for now, safe travels."
,,5,March 2025,,Outstanding,"One of the best hotel experiences anywhere in the world. Gorgeous hotel, fantastic location - and the attention to detail and personal customer service are outstanding. Christian, Chris and their superb team could not have done any more to make our stay so special. Highly recommend.",,"Christian de Boer, Owner|Good afternoon, What a lovely review to wake up to. It's always so rewarding when we have been able to showcase the best of Khmer hospitality mixed with our 'no nickel & dime' approach. I would like to use this opportunity to thank you for taking the time to write down your experience with us and choosing us as your hotel in Siem Reap. We hope to be able to welcome you back at some point in the not too distant future. For now, safe travels."
,,5,March 2025,,Brilliant stay,"Not sure what I could write differently to all the previous reviews as it was a superb stay which everyone seems to experience when they stay at this hotel. Staff totally make the place and a special shout out for Finn at the front desk. The establishment seems to operate to the highest possible standards under impressive leadership. Our room was immaculate and had everything you could need including a free mini bar. We overlooked the smaller of the swimming pools which was ideal for anyone wanting to find a quieter shady spot. We took up the offer of a daily one hour massage, which was complementary and felt totally chilled out by the end of our stay. The hotel also organised a guided tour with a brilliant English speaking guide called Tom. He was so knowledgeable and engaging, and spoke perfect English. We’d highly recommend using Tom as he knew how to find viewpoints and at what timings to visit the temples to avoid the large parties, he really made it an unforgettable experience. Included in that day was a set menu meal at the hotel which was delicious and very high-quality, as was the breakfast every day. The hotel also recommended a couple of excellent restaurants and we particularly liked Jomno. The hotel organises a free tuk tuk service to take you to the restaurants and anywhere else you want to go around town, and also provide a cell phone so that you can just call when you want to be picked up; absolutely brilliant! At the hotel, don’t miss happy hour in the sky bar which was very good. The other point to note is that the hotel offers a free limitless daily laundry service which was so helpful with the sweltering heat at the temples.",,"Christian de Boer, General Manager|Hi Patricia, Thank you so much for your wonderful review of Jaya House! We are thrilled to hear that you had a brilliant stay with us. Your kind words about our staff, especially Finn at the front desk, truly mean a lot to us. We pride ourselves on delivering high standards, and it's fantastic to know that our efforts have not gone unnoticed. We’re glad you enjoyed the room, the peaceful view of the pool, and the complimentary massage. It's great to hear that Tom provided you with such an engaging and informative tour experience, and we appreciate you recommending him to other guests! We’re also pleased to know that you enjoyed our dining options and the complimentary tuk-tuk service. Our team is dedicated to making your stay as comfortable and memorable as possible, and it's rewarding to see that reflected in your experience. Thank you once again for your delightful feedback. We hope to welcome you back to our hotel for another unforgettable stay in the future! Warm regards, Christian and The Jaya House team."
,,5,March 2025,,Jaya House - Siam Reap,What a fantastic experience! The facility and staff were so welcoming and generous. I cannot recommend it enough! The junior suite we stayed in was spacious and very clean. The bed and pillows were some of the best I’ve found anywhere I’ve travelled. Really convenient location in the city but still very quiet. Superb!,,"Christian de Boer, General Manager|Hi Greg, Thank you so much for your wonderful review of Jaya House! We’re thrilled to hear that you had a fantastic experience during your stay. It's great to know that you found our junior suite spacious and clean, and that our bed and pillows met your expectations. We take pride in our welcoming staff and strive to create a comfortable atmosphere for all our guests. It’s also nice to hear that you enjoyed our convenient yet quiet location in the city. We truly appreciate your recommendation and hope to welcome you back soon for another superb stay! Warm regards, Christian and The Jaya House team."
,,5,March 2025,,99% perfect,"Service was perfect, everything from the tuktuk drivers, maids, front desk and servers were absolutely amazing. Pools, bars and easy access to the town made our stay easy and pleasant. They make a real effort to be environmentally conscious so it is easy to rest knowing you are limiting your footprint on the world while traveling; which is very hard to do. Only complaint would be that at one point, when I tried to go to the pool, there were no lounge chairs available. Other than that, perfect.",,"Christian de Boer, General Manager|Hi Aaron, Thank you so much for your wonderful review! We're thrilled to hear that you had such an enjoyable stay at Jaya House and that our team made a positive impact on your experience. It’s great to know that you appreciated our commitment to environmental sustainability as well. We apologize for the inconvenience you faced with the lounge chairs by the pool. We strive to provide ample seating for all our guests, and we appreciate your patience. Your feedback helps us improve, and we will certainly look into this matter. Thanks again for your kind words, and we hope to welcome you back for another perfect stay in the future! Best regards, Christian and The Jaya House team."
,,5,March 2025,,Genuine Care,"Great hotel with very attentive and supportive staff. They are very personable and genuinely caring! The amenities are great and the food was very good! Massages were great, quick laundry services, and good coffee and tea on demand. Free tuktuk rides with helpful drivers who gives recommendations too!",,"Christian de Boer, General Manager|Hi Voyager43544546819, Thank you so much for your wonderful review of Jaya House! We're thrilled to hear that you enjoyed your stay with us and found our staff attentive and caring. It’s great to know that you appreciated the amenities, food, and massage services. We’re also glad you took advantage of the tuk-tuk rides and found our drivers helpful. Your feedback means a lot to us, and we hope to welcome you back for another relaxing stay soon. Warm regards, Christian and The Jaya House team."
,,5,March 2025,,Five plus Stars,"We were greeted by the manager at dinner in a restaurant in Siam Reap far from the hotel he explained his passion to stop using plastic water bottles, making their own botanicals for bug spray to shampoo. Every time we reentered the hotel we were met outside by someone holding a tray of cool towels neatly rolled and smelling of jasmine or similar floral scent. The decor, art and landscaping are all world class stunning and understated. Words are inadequate to explain how kind all the staff is. Money can’t buy the genuine smiles on each of their faces. Everyone was so attentive to anything we might want. We were pampered in a serene oasis that surpasses any luxury hotel we ever stayed in. Don’t hesitate to come to this spectacular small hotel with only 36 rooms.",,"Christian de Boer, General Manager|Hi Robert, Thank you so much for your glowing review! We are thrilled to hear that you had such a memorable experience during your stay with us. It's wonderful to know that our efforts to be more environmentally conscious resonated with you, and we truly appreciate your support for our initiatives. We're delighted that you enjoyed our welcoming gestures, like the cool towels, and that our decor and landscaping left a lasting impression. Our team takes great pride in providing genuine hospitality, and your kind words about their attentiveness and smiles mean the world to us. It’s an honor to be considered a serene oasis for our guests, and we’re so glad you found it surpassing your expectations. We hope to welcome you back to our small slice of paradise soon! Warm regards, Christian and The Jaya House team."
,,5,March 2025,,Five star experience,"We can’t recommend this hotel enough…gracious doesn’t begin to describe the service. Welcoming and responsive staff, hands on management that ensures guests needs are met swiftly and efficiently. Grounds, common areas and rooms are thoughtfully and beautifully designed. Convenient tuktuk service at a moment’s notice and complimentary amenities including massage and room mini bar are a dream come true! The food is fresh and delicious - and they bake all their own bread. Most impressive is this hotel is a social enterprise, training and employing local residents in an elevated five star hotel. We would return again.",,"Christian de Boer, General Manager|Hi Liz, Thank you so much for your wonderful review! We are thrilled to hear that you had a five-star experience at Jaya House. Our team works hard to provide gracious service and ensure that every guest feels welcomed and cared for, so it's rewarding to know that we met your expectations. We're also glad you enjoyed the thoughtfully designed spaces and our convenient tuktuk service. It's fantastic to hear that you appreciated our complimentary amenities, especially the fresh food and homemade bread! Knowing that you recognize and value this aspect of our hotel means a lot to us. We can’t wait to welcome you back for another memorable stay. Thank you for the recommendation! Warm regards, Christian and The Jaya House team."
